{
  "$schema": "https://json-schema.org/draft/2020-12/schema",
  "$id": "https://skenion.dev/schemas/graph/v0.1/graph.schema.json",
  "title": "skenion Graph Document v0.1",
  "type": "object",
  "required": ["schema", "schemaVersion", "id", "revision", "nodes", "edges"],
  "properties": {
    "schema": {
      "const": "skenion.graph"
    },
    "schemaVersion": {
      "const": "0.1.0"
    },
    "id": {
      "type": "string",
      "minLength": 1
    },
    "revision": {
      "type": "string",
      "minLength": 1
    },
    "nodes": {
      "type": "array",
      "items": {
        "$ref": "#/$defs/node"
      }
    },
    "edges": {
      "type": "array",
      "items": {
        "$ref": "#/$defs/edge"
      }
    },
    "cableStyles": {
      "$ref": "#/$defs/cableStyleRegistry"
    }
  },
  "additionalProperties": false,
  "$defs": {
    "node": {
      "type": "object",
      "required": ["id", "kind", "kindVersion", "params", "ports"],
      "properties": {
        "id": {
          "type": "string",
          "minLength": 1
        },
        "kind": {
          "type": "string",
          "minLength": 1
        },
        "kindVersion": {
          "type": "string",
          "minLength": 1
        },
        "params": {
          "type": "object",
          "additionalProperties": true
        },
        "ports": {
          "type": "array",
          "items": {
            "$ref": "#/$defs/port"
          }
        },
        "portGroups": {
          "type": "array",
          "items": {
            "$ref": "#/$defs/portGroup"
          }
        }
      },
      "additionalProperties": false
    },
    "port": {
      "type": "object",
      "required": ["id", "direction", "type"],
      "properties": {
        "id": {
          "type": "string",
          "minLength": 1
        },
        "direction": {
          "enum": ["input", "output"]
        },
        "type": {
          "type": "string",
          "minLength": 1
        },
        "label": {
          "type": "string"
        },
        "rate": {
          "enum": ["event", "control", "audio", "render", "gpu", "resource", "io"]
        },
        "accepts": {
          "type": "array",
          "items": {
            "type": "string",
            "minLength": 1
          },
          "uniqueItems": true
        },
        "minConnections": {
          "type": "integer",
          "minimum": 0
        },
        "maxConnections": {
          "oneOf": [
            {
              "type": "integer",
              "minimum": 0
            },
            {
              "type": "null"
            }
          ]
        },
        "mergePolicy": {
          "enum": ["forbid", "ordered-events", "mix", "array", "latest", "first", "custom"]
        },
        "fanOutPolicy": {
          "enum": ["allow", "forbid", "copy", "share"]
        },
        "triggerMode": {
          "enum": ["passive", "trigger", "latched"]
        },
        "defaultValue": true,
        "latch": {
          "type": "boolean"
        },
        "required": {
          "type": "boolean"
        },
        "styleKey": {
          "type": "string",
          "minLength": 1
        },
        "group": {
          "type": "string",
          "minLength": 1
        },
        "description": {
          "type": "string"
        }
      },
      "additionalProperties": false
    },
    "portGroup": {
      "type": "object",
      "required": ["id", "direction", "type", "minPorts"],
      "properties": {
        "id": {
          "type": "string",
          "minLength": 1
        },
        "label": {
          "type": "string"
        },
        "direction": {
          "enum": ["input", "output"]
        },
        "type": {
          "type": "string",
          "minLength": 1
        },
        "rate": {
          "enum": ["event", "control", "audio", "render", "gpu", "resource", "io"]
        },
        "minPorts": {
          "type": "integer",
          "minimum": 0
        },
        "maxPorts": {
          "type": "integer",
          "minimum": 0
        },
        "ordered": {
          "type": "boolean"
        },
        "portIdPattern": {
          "type": "string",
          "minLength": 1
        },
        "createLabel": {
          "type": "string"
        },
        "defaultPortSpec": {
          "$ref": "#/$defs/port"
        }
      },
      "additionalProperties": false
    },
    "edge": {
      "type": "object",
      "required": ["id", "source", "target"],
      "properties": {
        "id": {
          "type": "string",
          "minLength": 1
        },
        "source": {
          "$ref": "#/$defs/portEndpoint"
        },
        "target": {
          "$ref": "#/$defs/portEndpoint"
        },
        "resolvedType": {
          "type": "string",
          "minLength": 1
        },
        "order": {
          "type": "integer",
          "minimum": 0
        },
        "enabled": {
          "type": "boolean"
        },
        "adapter": {
          "type": "string",
          "minLength": 1
        },
        "feedback": {
          "$ref": "#/$defs/feedbackPolicy"
        },
        "styleOverride": {
          "type": "string",
          "minLength": 1
        },
        "label": {
          "type": "string"
        },
        "description": {
          "type": "string"
        }
      },
      "additionalProperties": false
    },
    "portEndpoint": {
      "type": "object",
      "required": ["nodeId", "portId"],
      "properties": {
        "nodeId": {
          "type": "string",
          "minLength": 1
        },
        "portId": {
          "type": "string",
          "minLength": 1
        }
      },
      "additionalProperties": false
    },
    "feedbackPolicy": {
      "type": "object",
      "required": ["enabled", "boundary"],
      "properties": {
        "enabled": {
          "type": "boolean"
        },
        "boundary": {
          "enum": [
            "same-turn",
            "next-tick",
            "control-frame",
            "audio-sample",
            "audio-block",
            "render-frame",
            "gpu-pingpong",
            "manual"
          ]
        },
        "initialValue": true,
        "recursionLimit": {
          "type": "integer",
          "minimum": 0
        },
        "maxEventsPerTick": {
          "type": "integer",
          "minimum": 1
        },
        "maxIterationsPerFrame": {
          "type": "integer",
          "minimum": 1
        },
        "bufferMode": {
          "enum": ["latest", "queue", "ring", "pingpong"]
        },
        "intentional": {
          "type": "boolean"
        },
        "label": {
          "type": "string"
        }
      },
      "additionalProperties": false
    },
    "cableStyleRegistry": {
      "type": "object",
      "additionalProperties": {
        "type": "object",
        "properties": {
          "color": {
            "type": "string"
          },
          "pattern": {
            "enum": ["solid", "dashed", "dotted"]
          },
          "width": {
            "type": "number",
            "exclusiveMinimum": 0
          },
          "marker": {
            "type": "string"
          }
        },
        "additionalProperties": false
      }
    }
  }
}
