{
  "schema": "skenion.graph",
  "schemaVersion": "0.1.0",
  "id": "help-object-core-unresolved",
  "revision": "1",
  "nodes": [
    {
      "id": "note_1",
      "kind": "object.core.comment",
      "kindVersion": "0.1.0",
      "params": {
        "text": "Unresolved Object preserves object spec that could not resolve, reports a Runtime diagnostic, and stays editable on the canvas."
      },
      "ports": []
    },
    {
      "id": "unresolved_1",
      "kind": "object.core.unresolved",
      "kindVersion": "0.1.0",
      "params": {
        "objectSpec": "user.manipulator",
        "diagnosticMessage": "extension object is not installed",
        "requestedKind": "user.manipulator"
      },
      "ports": []
    }
  ],
  "edges": []
}
